{
  "$schema": "http://json-schema.org/draft-07/schema#",
  "title": "Momo Paper · Resume",
  "type": "object",
  "required": ["document_type", "locale", "meta", "sections"],
  "properties": {
    "document_type": { "type": "string", "const": "resume" },
    "locale": { "type": "string", "enum": ["zh-CN", "en"] },
    "meta": {
      "type": "object",
      "required": ["title", "subtitle"],
      "properties": {
        "title": { "type": "string" },
        "subtitle": { "type": "string" },
        "eyebrow": { "type": "string" },
        "location": { "type": "string" },
        "email": { "type": "string" },
        "website": { "type": "string" }
      }
    },
    "sections": {
      "type": "object",
      "properties": {
        "profile": {
          "type": "object",
          "properties": {
            "summary": { "type": "string" }
          }
        },
        "experience": {
          "type": "array",
          "items": {
            "type": "object",
            "properties": {
              "role": { "type": "string" },
              "company": { "type": "string" },
              "period": { "type": "string" },
              "highlights": { "type": "array", "items": { "type": "string" } }
            }
          }
        },
        "projects": {
          "type": "array",
          "items": {
            "type": "object",
            "properties": {
              "name": { "type": "string" },
              "description": { "type": "string" },
              "impact": { "type": "string" }
            }
          }
        },
        "education": {
          "type": "array",
          "items": {
            "type": "object",
            "properties": {
              "degree": { "type": "string" },
              "school": { "type": "string" },
              "year": { "type": "string" }
            }
          }
        }
      }
    }
  }
}
