{
  "document_type": "resume",
  "locale": "zh-CN",
  "meta": {
    "title": "简历",
    "subtitle": "高级产品设计师 · 8 年经验",
    "eyebrow": "Momo Paper / resume / zh-CN",
    "location": "北京",
    "email": "zhangsan@example.com",
    "website": "zhangsan.design"
  },
  "sections": {
    "profile": {
      "summary": "8 年产品设计经验，专注于复杂 B2B SaaS 产品。擅长设计系统建设、用户研究方法论和跨职能协作。主导过 3 次大型产品改版，推动核心指标提升 30%+。设计系统贡献者，GitHub 开源项目 2k+ stars。"
    },
    "experience": [
      {
        "role": "高级产品设计师",
        "company": "云帆科技 · 设计团队 Lead",
        "period": "2023.03 — 至今",
        "highlights": [
          "主导企业级协作平台设计改版，DAU 从 85 万增长至 120 万（+41%）",
          "建立设计令牌系统，设计组件复用率从 35% 提升至 78%",
          "管理 5 人设计团队，建立双周设计评审和月度用户访谈机制",
          "推动无障碍设计规范落地，产品 WCAG 2.1 AA 合规率从 45% 提升至 92%"
        ]
      },
      {
        "role": "产品设计师",
        "company": "星辰互娱 · 增长设计组",
        "period": "2021.06 — 2023.02",
        "highlights": [
          "设计游戏化增长体系，新用户 7 日留存率提升 12pp（28% → 40%）",
          "搭建 A/B 实验设计框架，年度完成 60+ 实验，胜率 35%",
          "与工程团队合作建立 UI 自动化测试流程，设计还原度从 70% 提升至 95%"
        ]
      },
      {
        "role": "初级 UI 设计师",
        "company": "蓝鲸数据 · 设计部",
        "period": "2018.08 — 2021.05",
        "highlights": [
          "负责数据可视化仪表盘设计，服务 200+ 企业客户",
          "建立组件库 v1.0，覆盖 50+ 基础组件"
        ]
      }
    ],
    "projects": [
      {
        "name": "Momo Paper 设计系统",
        "description": "开源的路由式文档设计系统，提供 15 种文档类型的模板和 JSON 渲染引擎。GitHub 2k+ stars。",
        "impact": "被 20+ 团队采用，月均渲染文档 5,000+ 份"
      },
      {
        "name": "智能搜索 2.0",
        "description": "基于语义理解的跨模块搜索功能，支持自然语言查询和结果可视化。",
        "impact": "搜索使用率 +180%，被评为公司年度最佳功能"
      }
    ],
    "education": [
      {"degree": "设计学硕士 · 交互设计方向", "school": "清华大学美术学院", "year": "2018"},
      {"degree": "工业设计学士", "school": "浙江大学", "year": "2016"}
    ]
  }
}
